[
  {
    "title": "Untitled",
    "slug": "sketch-001",
    "original_title": null,
    "proposed_title": "Sketch 001",
    "classification": {
      "type": "sketch",
      "confidence": 0.74
    },
    "curatorial_status": "curatorial-review",
    "subjects": [
      "visages-masks"
    ],
    "motifs": [
      {
        "id": "visages-masks",
        "confidence": 0.6
      }
    ],
    "themes": [],
    "constellations": [],
    "relationships": [],
    "assets": [
      {
        "role": "primary",
        "path": "/posts/Sketch-001/image.jpg",
        "original_filename": "IMG_20150301_114548.jpg",
        "asset_capture_date": null,
        "confidence": 0.95,
        "alt": "Dense black-ink drawing of overlapping faces, eyes, and curling organic forms."
      },
      {
        "role": "alternate",
        "path": null,
        "availability": "source-unavailable",
        "original_filename": "IMG_20150301_114553.jpg",
        "asset_capture_date": null,
        "confidence": 0.8
      }
    ],
    "provenance": {
      "artwork_creation_date": null,
      "notes": "Creation date not inferred from photograph metadata.",
      "source_records": [
        "curatorial-review-v1"
      ]
    },
    "artwork_id": "lv-artwork-sketch-001"
  },
  {
    "title": "Untitled",
    "slug": "sketch-002",
    "original_title": null,
    "proposed_title": "Sketch 002",
    "classification": {
      "type": "sketch",
      "confidence": 0.74
    },
    "curatorial_status": "curatorial-review",
    "subjects": [
      "eyes-gaze"
    ],
    "motifs": [
      {
        "id": "eyes-gaze",
        "confidence": 0.7
      }
    ],
    "themes": [],
    "constellations": [],
    "relationships": [],
    "assets": [
      {
        "role": "primary",
        "path": "/posts/Sketch-002/image.jpg",
        "original_filename": "IMG_20150301_115722.jpg",
        "asset_capture_date": null,
        "confidence": 0.95,
        "alt": "Faint pencil drawing of a tall, narrow abstract form above two rounded, eye-like shapes."
      },
      {
        "role": "alternate",
        "path": null,
        "availability": "source-unavailable",
        "original_filename": "20150301_175722000_iOS.jpg",
        "asset_capture_date": null,
        "confidence": 0.8
      }
    ],
    "provenance": {
      "artwork_creation_date": null,
      "notes": "Creation date not inferred from photograph metadata.",
      "source_records": [
        "curatorial-review-v1"
      ]
    },
    "artwork_id": "lv-artwork-sketch-002"
  },
  {
    "title": "Untitled",
    "slug": "sketch-004",
    "original_title": null,
    "proposed_title": "Sketch 004",
    "classification": {
      "type": "sketch",
      "confidence": 0.74
    },
    "curatorial_status": "curatorial-review",
    "subjects": [
      "figures-bodies"
    ],
    "motifs": [
      {
        "id": "figures-bodies",
        "confidence": 0.9
      }
    ],
    "themes": [],
    "constellations": [],
    "relationships": [],
    "assets": [
      {
        "role": "primary",
        "path": "/posts/Sketch-004/image.jpg",
        "original_filename": "Sketch-004.jpg",
        "asset_capture_date": null,
        "confidence": 0.95,
        "alt": "Blue concentric circles with a smaller green circular motif beneath, inside loose oval outlines."
      }
    ],
    "provenance": {
      "artwork_creation_date": null,
      "notes": "Creation date not inferred from photograph metadata.",
      "source_records": [
        "curatorial-review-v1"
      ]
    },
    "artwork_id": "lv-artwork-sketch-004"
  },
  {
    "title": "Untitled",
    "slug": "sketch-005",
    "original_title": null,
    "proposed_title": "Sketch 005",
    "classification": {
      "type": "sketch",
      "confidence": 0.74
    },
    "curatorial_status": "curatorial-review",
    "subjects": [
      "animals-hybrids"
    ],
    "motifs": [
      {
        "id": "animals-hybrids",
        "confidence": 0.5
      }
    ],
    "themes": [],
    "constellations": [],
    "relationships": [],
    "assets": [
      {
        "role": "primary",
        "path": "/posts/Sketch-005/image.jpg",
        "original_filename": "Sketch-005.jpg",
        "asset_capture_date": null,
        "confidence": 0.95,
        "alt": "Vertical arrangement of colored circles and eyes linked by fine lines."
      }
    ],
    "provenance": {
      "artwork_creation_date": null,
      "notes": "Creation date not inferred from photograph metadata.",
      "source_records": [
        "curatorial-review-v1"
      ]
    },
    "artwork_id": "lv-artwork-sketch-005"
  },
  {
    "title": "Untitled",
    "slug": "sketch-006",
    "original_title": null,
    "proposed_title": "Sketch 006",
    "classification": {
      "type": "sketch",
      "confidence": 0.74
    },
    "curatorial_status": "curatorial-review",
    "subjects": [
      "symbols-cosmograms"
    ],
    "motifs": [
      {
        "id": "symbols-cosmograms",
        "confidence": 0.6
      }
    ],
    "themes": [],
    "constellations": [],
    "relationships": [],
    "assets": [
      {
        "role": "primary",
        "path": "/posts/Sketch-006/image.jpg",
        "original_filename": "Sketch-006.jpg",
        "asset_capture_date": null,
        "confidence": 0.95,
        "alt": "Monochrome close-up portrait of a bearded man, shaded from the shoulders up."
      }
    ],
    "provenance": {
      "artwork_creation_date": null,
      "notes": "Creation date not inferred from photograph metadata.",
      "source_records": [
        "curatorial-review-v1"
      ]
    },
    "artwork_id": "lv-artwork-sketch-006"
  },
  {
    "title": "Untitled",
    "slug": "sketch-007",
    "original_title": null,
    "proposed_title": "Sketch 007",
    "classification": {
      "type": "sketch",
      "confidence": 0.74
    },
    "curatorial_status": "curatorial-review",
    "subjects": [
      "composite-worlds"
    ],
    "motifs": [
      {
        "id": "composite-worlds",
        "confidence": 0.7
      }
    ],
    "themes": [],
    "constellations": [],
    "relationships": [],
    "assets": [
      {
        "role": "primary",
        "path": "/posts/Sketch-007/image.jpg",
        "original_filename": "Sketch-007.jpg",
        "asset_capture_date": null,
        "confidence": 0.95,
        "alt": "Loose pencil studies of a mask-like face and a four-legged animal."
      }
    ],
    "provenance": {
      "artwork_creation_date": null,
      "notes": "Creation date not inferred from photograph metadata.",
      "source_records": [
        "curatorial-review-v1"
      ]
    },
    "artwork_id": "lv-artwork-sketch-007"
  },
  {
    "title": "Untitled",
    "slug": "sketch-008",
    "original_title": null,
    "proposed_title": "Sketch 008",
    "classification": {
      "type": "sketch",
      "confidence": 0.74
    },
    "curatorial_status": "curatorial-review",
    "subjects": [
      "visages-masks"
    ],
    "motifs": [
      {
        "id": "visages-masks",
        "confidence": 0.8
      }
    ],
    "themes": [],
    "constellations": [],
    "relationships": [],
    "assets": [
      {
        "role": "primary",
        "path": "/posts/Sketch-008/image.jpg",
        "original_filename": "Sketch-008.jpg",
        "asset_capture_date": null,
        "confidence": 0.95,
        "alt": "Black-ink frontal portrait with elongated facial features and dark, pointed strokes around the head."
      }
    ],
    "provenance": {
      "artwork_creation_date": null,
      "notes": "Creation date not inferred from photograph metadata.",
      "source_records": [
        "curatorial-review-v1"
      ]
    },
    "artwork_id": "lv-artwork-sketch-008"
  },
  {
    "title": "Untitled",
    "slug": "sketch-009",
    "original_title": null,
    "proposed_title": "Sketch 009",
    "classification": {
      "type": "sketch",
      "confidence": 0.74
    },
    "curatorial_status": "curatorial-review",
    "subjects": [
      "eyes-gaze"
    ],
    "motifs": [
      {
        "id": "eyes-gaze",
        "confidence": 0.9
      }
    ],
    "themes": [],
    "constellations": [],
    "relationships": [],
    "assets": [
      {
        "role": "primary",
        "path": "/posts/Sketch-009/image.jpg",
        "original_filename": "Sketch-009.jpg",
        "asset_capture_date": null,
        "confidence": 0.95,
        "alt": "Pencil drawing of an upright hand with an eye above the fingertips."
      }
    ],
    "provenance": {
      "artwork_creation_date": null,
      "notes": "Creation date not inferred from photograph metadata.",
      "source_records": [
        "curatorial-review-v1"
      ]
    },
    "artwork_id": "lv-artwork-sketch-009"
  },
  {
    "title": "Untitled",
    "slug": "sketch-010",
    "original_title": null,
    "proposed_title": "Sketch 010",
    "classification": {
      "type": "sketch",
      "confidence": 0.74
    },
    "curatorial_status": "curatorial-review",
    "subjects": [
      "hands-gesture"
    ],
    "motifs": [
      {
        "id": "hands-gesture",
        "confidence": 0.5
      }
    ],
    "themes": [],
    "constellations": [],
    "relationships": [],
    "assets": [
      {
        "role": "primary",
        "path": "/posts/Sketch-010/image.jpg",
        "original_filename": "Sketch-010.jpg",
        "asset_capture_date": null,
        "confidence": 0.95,
        "alt": "Loose figure drawing with a raised arm and a broad, rounded lower body."
      }
    ],
    "provenance": {
      "artwork_creation_date": null,
      "notes": "Creation date not inferred from photograph metadata.",
      "source_records": [
        "curatorial-review-v1"
      ]
    },
    "artwork_id": "lv-artwork-sketch-010"
  },
  {
    "title": "Untitled",
    "slug": "sketch-011",
    "original_title": null,
    "proposed_title": "Sketch 011",
    "classification": {
      "type": "sketch",
      "confidence": 0.74
    },
    "curatorial_status": "curatorial-review",
    "subjects": [